{
  "protocolVersion": 1,
  "runtimeVersion": "test-runtime-1.0.0",
  "inputSha256": "61d161b16828888da7d4eb810acee76ababbbc984563f92a3a47408a0449a8c0",
  "summary": "Review identified 1 finding in the authentication module.",
  "findings": [
    {
      "severity": "medium",
      "confidence": "high",
      "category": "test_coverage",
      "title": "Missing unit tests for login function",
      "body": "The login function has no test coverage.",
      "path": "src/auth/login.ts",
      "startLine": 1,
      "endLine": 10,
      "suggestedAction": "Add unit tests covering successful and failed login paths.",
      "inlinePreference": "allowed"
    }
  ],
  "limitations": ["Static analysis only; no runtime behavior tested."],
  "usage": {
    "inputTokens": 5000,
    "cacheReadInputTokens": 3000,
    "cacheCreationInputTokens": 2000,
    "outputTokens": 800,
    "recordsObserved": 1
  },
  "observedTurns": 1,
  "observedTurnSource": "unique_assistant_message_ids",
  "warnings": [],
  "diagnostics": [],
  "trace": {
    "path": "trace.json",
    "sha256": "fe11a395f4818fb3ddcfa5246cbe4b669121b58229d017e56ad35efdc00d924e"
  }
}
