{"protocolVersion":1,"runtimeVersion":"0.1.0-dev","inputSha256":"61d161b16828888da7d4eb810acee76ababbbc984563f92a3a47408a0449a8c0","summary":"Deterministic fixture runtime completed without findings.","findings":[],"limitations":["No live provider was invoked."],"warnings":[],"diagnostics":[],"trace":{"sha256":"c681b3c43c2cbb000fac567de72903ecaa31f5f4e90b4df9ee981858e4377f6c"}}